{
  "artifact": "CANON/shelf-count-v1.0.0.md",
  "artifact_id": "artifact.shelf-count.v1_0_0",
  "artifact_sha256": "89e74f90e9800f132e9189ad5cf4abf7d4e046eb802da2a92aa2647809c07ac5",
  "notes": "Pass for the bounded shelf-count claim. Checked the count sheet totals, the ledger reconciliation story, and the stated unknowns.",
  "review_id": "review.shelf-count.v2",
  "reviewed_utc": "2026-07-12T09:35:00Z",
  "reviewer_class": "separate-instance",
  "schema": "bvm-review/0.1",
  "scope": "Exact artifact bytes against the hash-bound count sheet and receipts.",
  "verdict": "pass"
}
